{
  "id": "k6-options-2",
  "categoryId": "k6",
  "subcategoryId": "k6-options",
  "title": "Ramping stages",
  "command": "export const options = {\n  stages: [\n    { duration: '30s', target: 20 },\n    { duration: '1m', target: 20 },\n    { duration: '30s', target: 0 },\n  ],\n};",
  "description": "Ramp VUs up and down."
}
