{
  "id": "temporal-task-queue-2",
  "categoryId": "temporal",
  "subcategoryId": "task-queue",
  "title": "Describe with reachability",
  "command": "temporal task-queue describe --task-queue my-queue --select-build-id v1.2.3 --report-reachability",
  "description": "Check Build ID reachability for versioning."
}
